FindingID,ChecklistItemRef,Document,SectionRef,FindingSeverity,Description,Origin,ProposedDisposition,HumanDisposition,Status,ReviewerID,Date
RF-001,AP-010,Specification.md,Documentation,INFO,"Anticipated artifacts `schemas/model.schema.yaml` and any `docs/TYPES.md` update are not produced in this tranche. The absence is explicitly documented as future/outside current write scope in Datasheet.md, Specification.md, Procedure.md, and TASK run records.",AGENT_CHECK,"PROPOSAL: DEFER",TBD,OPEN,AGENT_CHECK,2026-04-30
RF-002,XD-002,Guidance.md,Conflict Table C-02-01-002,MINOR,"Stale decomposition-basis metadata remains visible: `_REFERENCES.md` reports accepted v0.2 and the guidance records `docs/README.md` as stale v0.3, while `_CONTEXT.md` and the user brief use revision 0.4 with SCA-001. This is visible and outside REVIEW write scope.",AGENT_CHECK,"PROPOSAL: REVISE",TBD,OPEN,AGENT_CHECK,2026-04-30
RF-003,OC-002,Guidance.md,Conflict Table C-02-01-001,INFO,"Objective mapping discrepancy remains visible: `_CONTEXT.md`, `Deliverables.csv`, and decomposition deliverable row use OBJ-001 for DEL-02-01, while `ScopeLedger.csv` row SOW-041 also maps OBJ-012. Human ruling remains TBD.",AGENT_CHECK,"PROPOSAL: DEFER",TBD,OPEN,AGENT_CHECK,2026-04-30
RF-004,DS-001,_DEPENDENCIES.md,Extracted Dependency Register,INFO,"Dependency extraction has not run and no concrete human-declared dependency list exists. `_DEPENDENCIES.md` records coordination as NOT_TRACKED and `Dependencies.csv`/summary as TBD, so no active upstream dependency can be mechanically evaluated.",AGENT_CHECK,"PROPOSAL: DEFER",TBD,OPEN,AGENT_CHECK,2026-04-30
RF-005,TB-001,GENERAL,TBD Inventory,INFO,"Twenty `TBD` occurrences remain across the four standard documents: Datasheet.md 2, Specification.md 2, Guidance.md 6, Procedure.md 10. They are visible and largely correspond to implementation-level or human-ruling decisions.",AGENT_CHECK,"PROPOSAL: DEFER",TBD,OPEN,AGENT_CHECK,2026-04-30
