DeliverableID,PackageID,Name,Description,Type,AnticipatedArtifacts,CoversScopeItems,SupportsObjectives,ContextEnvelope,ContextEnvelopeNotes
DEL-13-04,PKG-13,Physical-to-analytical transformation contract,Implement the contract for deriving solver-ready analytical models from physical models with traceable transformation warnings.,BACKEND_FEATURE_SLICE,physical-to-analytical transform contract; transform warning tests,SOW-066,OBJ-014,L,First-class bridge from design authoring to solver execution.
DEL-14-01,PKG-14,Immutable model state records,"Define and implement immutable model state records with names, tags, notes, external references, assumptions, warnings, and hashes.",DATA_MODEL_CHANGE,schemas/model_state.schema.json; model state persistence tests,SOW-071,OBJ-016,M,Flexible metadata only; no formal prover approval statuses.
DEL-14-02,PKG-14,Analysis run records,"Define and implement analysis run records bound to model states, solver versions, settings, units, load cases, diagnostics, results, and hashes.",DATA_MODEL_CHANGE,schemas/analysis_run.schema.json; run reproducibility tests,SOW-072,OBJ-016,M,Results attach to immutable run records.
DEL-14-03,PKG-14,Model-state comparison engine,Implement deterministic state diffs using stable IDs and explicit mapping records.,BACKEND_FEATURE_SLICE,state comparison engine; state diff tests,"SOW-073,SOW-071",OBJ-016,L,Reports added/removed/changed/unchanged model entities.
DEL-14-04,PKG-14,Analysis-run comparison engine,"Implement unit-normalized result deltas for mapped entities, diagnostics, and settings.",BACKEND_FEATURE_SLICE,run comparison engine; result delta tests,"SOW-073,SOW-072",OBJ-016,L,Comparison is diagnostic/audit functionality only.
DEL-14-05,PKG-14,"Comparison mapping, tolerance, and export contracts","Define manual mappings, unmatched classifications, tolerance profiles, and CSV/JSON/report-section exports.",API_CONTRACT,comparison mapping schema; tolerance profile schema; comparison exporters,SOW-073,OBJ-016,M,Future external result states may be represented without changing core compare logic.
DEL-15-01,PKG-15,Canonical handoff package schema and manifest,"Define handoff package schema and manifest with hashes, units, entity IDs, library/rule refs, warnings, assumptions, and provenance.",API_CONTRACT,schemas/handoff_package.schema.json; handoff manifest schema,SOW-074,OBJ-017,M,Package is for downstream modeling and professional validation workflows.
DEL-15-02,PKG-15,Target mapping and unsupported-behavior contract,Define target mapping metadata and unsupported/approximate behavior flags for handoff exports.,API_CONTRACT,target mapping schema; unsupported behavior taxonomy,SOW-074,OBJ-017,M,Avoids silent loss of critical assumptions or unsupported target behavior.
DEL-15-03,PKG-15,Downstream modeling export workflow,Implement generic handoff export workflow before target-specific commercial-tool parsers are in scope.,BACKEND_FEATURE_SLICE,handoff exporter; export validation tests; invented target fixture,SOW-074,OBJ-017,L,Target-specific commercial stress output parsers remain deferred.
DEL-15-04,PKG-15,External prover boundary metadata,"Implement flexible external-reference metadata without hard-coded approval, certification, or code-compliance statuses.",DATA_MODEL_CHANGE,external reference fields; boundary validation tests,SOW-075,"OBJ-017,OBJ-018",M,Preserves non-authoritative professional reliance boundary.
DEL-16-01,PKG-16,Structured model operation schema,"Define structured add, move, modify, delete, reconnect, constraint, load, support, and design-knowledge operations.",DATA_MODEL_CHANGE,schemas/model_operation.schema.json; operation fixtures,SOW-069,OBJ-015,M,Operations are the only model mutation route for GUI and agent proposals.
DEL-16-02,PKG-16,Operation validation and diff preview,Run schema and constraint validation and create deterministic previews before applying operations.,BACKEND_FEATURE_SLICE,operation validator; diff preview service; validation tests,SOW-069,OBJ-015,M,Blocks invalid operations before application.
DEL-16-03,PKG-16,User acceptance and operation audit trail,"Record accepted/rejected operations, affected entities, actor/source metadata, timestamps, and assumptions.",BACKEND_FEATURE_SLICE,operation audit log; acceptance workflow tests,"SOW-069,SOW-070",OBJ-015,M,Default workflow requires user acceptance unless later explicitly changed.
DEL-16-04,PKG-16,Agent rationale and professional-boundary controls,"Capture agent rationale and unresolved assumptions while preventing certification, approval, or code-compliance claims.",SECURITY_CONTROL,agent rationale record; professional-boundary guard tests,SOW-070,"OBJ-015,OBJ-018",S,Agent output cannot become accepted engineering work by itself.
